Rouge,"J'ai toujours reve d'un mouton clown, leur nez me font tellement envie.",
Bleu,Je recherche un mouton de l'ocean,
Vert,Peut etre aue la laine que je recherche viens d'in mouton malade ou juste un qui a mage trop d'herbe.,
Noir,Ah ! Je l'ai vue l'autre jour il avait la couleur de ce chat qui porte malheur ! Ramene le moi !,
Blanc,L'hiver est une tres belle saison de reve de me faire le meme manteau.,
Gris,"Je recherche ce mouton rare, je suis persuade qu'il etait plien de poussiere vu son etat.",
Jaune,Retrouve moi mon petit poussin d'amour !,
Cyan,Cest pas bleu c'est c..hiant a dire,Couleur etudier beaucoup en Cyanthologie
Magenta,"J'ai deja le jaune et cyan, on m'a dit au'il me manquait le troisieme tu sais celui qu'on trouve souvent avec.",